number,value,datetime_start,datetime_complete,duration,params_activacion,params_arquitectura,params_batch_size,params_clip_range,params_ent_coef,params_esquema_lr,params_learning_rate,params_log_std_init,params_n_epochs,params_n_steps,user_attrs_minutos,user_attrs_paso_mejor,user_attrs_pct_seguro_real,user_attrs_sobrecosto_medio,system_attrs_tpe:relative_params:0,state
0,-0.299064746229148,2026-10-02 16:40:19.079262,2026-10-02 16:45:21.309005,0 days 00:05:02.229743,relu,media,512,0.3,3.905441275210794e-06,constante,5.6115164153345e-05,-1.6317900473488922,5,1024,4.912282427151998,300000,90.0,0.28492724499916416,,COMPLETE
1,-0.34167044317134815,2026-10-02 16:40:20.927582,2026-10-02 16:45:20.390125,0 days 00:04:59.462543,tanh,pequena,128,0.1,0.0001109629437378074,lineal,4.371462400796332e-05,-1.6368398115533396,5,128,4.857397170861562,300000,91.33333333333333,0.29605052420194844,,COMPLETE
2,-8.345688006124576,2026-10-02 16:45:20.807101,2026-10-02 16:50:38.713356,0 days 00:05:17.906255,tanh,media,512,0.3,1.78982036983703e-05,lineal,1.5994732061908183e-05,-0.5613002530787403,10,64,5.19545038541158,50000,85.33333333333334,0.627246325531281,,COMPLETE
3,0.8159395053817502,2026-10-02 16:45:21.675749,2026-10-02 16:52:23.803974,0 days 00:07:02.128225,relu,media,128,0.2,0.0028570800750407216,lineal,0.00037183641805732076,-2.445436633423419,10,256,6.939377534389496,300000,92.66666666666666,0.17732760532460895,,COMPLETE
4,1.1053500665218539,2026-10-02 16:50:39.119639,2026-10-02 16:54:24.299660,0 days 00:03:45.180021,tanh,pequena,512,0.2,1.4958437460620315e-05,constante,0.0002269964692600708,-2.132740526793448,20,64,3.644849260648092,250000,90.0,0.14174505685615632,,COMPLETE
5,0.9530836088703339,2026-10-02 16:52:24.216363,2026-10-02 16:55:32.829827,0 days 00:03:08.613464,relu,pequena,256,0.3,2.8009403633756767e-08,lineal,0.0008692991511139548,-0.8794279684571489,5,256,3.0452907999356587,300000,91.66666666666666,0.1638575760761117,,COMPLETE
6,1.5247094872969955,2026-10-02 16:54:24.718000,2026-10-02 17:00:06.178794,0 days 00:05:41.460794,relu,grande,256,0.2,7.33681554564786e-07,lineal,0.0009104607590743016,-1.4864329351490566,10,64,5.592625800768534,250000,94.0,0.11798236871248624,,COMPLETE
7,-3.0223480609333957,2026-10-02 16:55:33.286344,2026-10-02 16:56:10.104251,0 days 00:00:36.817907,tanh,pequena,512,0.3,2.3316490638960624e-05,constante,0.0002870875348195468,-2.6763257190200864,10,256,0.5102859854698181,50000,88.33333333333333,0.5715524141350228,,PRUNED
8,-4.592668125522749,2026-10-02 16:56:10.447845,2026-10-02 16:56:55.372416,0 days 00:00:44.924571,tanh,grande,256,0.1,0.0022664909586669274,constante,1.1557352816269867e-05,-2.316194512374175,5,128,0.6493707577387492,50000,67.66666666666666,0.5689239981655599,,PRUNED
9,-0.23105666768215768,2026-10-02 16:56:55.777604,2026-10-02 17:00:41.354089,0 days 00:03:45.576485,tanh,pequena,64,0.2,2.074404014145339e-05,constante,3.073148556118437e-05,-1.4435099660533421,20,512,3.659228626887004,150000,95.33333333333334,0.29654818273659916,"{""activacion"": ""tanh"", ""arquitectura"": ""pequena"", ""batch_size"": 64, ""clip_range"": 0.2, ""ent_coef"": 2.074404014145339e-05, ""esquema_lr"": ""constante"", ""learning_rate"": 3.073148556118437e-05, ""log_std_init"": -1.4435099660533421, ""n_epochs"": 20, ""n_steps"": 512}",PRUNED
10,-3.895152230767257,2026-10-02 17:00:06.661570,2026-10-02 17:00:59.563024,0 days 00:00:52.901454,relu,grande,512,0.2,8.283431323400725e-05,lineal,0.0002880153381576496,-0.6744562359777632,10,64,0.7814244786898296,50000,76.33333333333333,0.15505276702693238,"{""activacion"": ""relu"", ""arquitectura"": ""grande"", ""batch_size"": 512, ""clip_range"": 0.2, ""ent_coef"": 8.283431323400725e-05, ""esquema_lr"": ""lineal"", ""learning_rate"": 0.0002880153381576496, ""log_std_init"": -0.6744562359777632, ""n_epochs"": 10, ""n_steps"": 64}",PRUNED
11,0.8114435539655527,2026-10-02 17:00:41.857988,2026-10-02 17:05:33.919503,0 days 00:04:52.061515,relu,grande,256,0.2,6.599122538125553e-06,lineal,0.00023879083725822023,-2.489145330973307,5,64,4.772269395987193,300000,88.66666666666667,0.1647992074739825,"{""activacion"": ""relu"", ""arquitectura"": ""grande"", ""batch_size"": 256, ""clip_range"": 0.2, ""ent_coef"": 6.599122538125553e-06, ""esquema_lr"": ""lineal"", ""learning_rate"": 0.00023879083725822023, ""log_std_init"": -2.489145330973307, ""n_epochs"": 5, ""n_steps"": 64}",PRUNED
12,1.0874466113449606,2026-10-02 17:00:59.938076,2026-10-02 17:05:11.004664,0 days 00:04:11.066588,tanh,pequena,256,0.2,1.7893155989830235e-06,lineal,0.0008122720922130001,-1.4934376878299112,10,64,4.076945475737253,200000,88.0,0.13739756678074483,"{""activacion"": ""tanh"", ""arquitectura"": ""pequena"", ""batch_size"": 256, ""clip_range"": 0.2, ""ent_coef"": 1.7893155989830235e-06, ""esquema_lr"": ""lineal"", ""learning_rate"": 0.0008122720922130001, ""log_std_init"": -1.4934376878299112, ""n_epochs"": 10, ""n_steps"": 64}",COMPLETE
13,-2.531099482390324,2026-10-02 17:05:11.494755,2026-10-02 17:06:04.893076,0 days 00:00:53.398321,relu,grande,512,0.2,5.917316047607217e-07,lineal,0.00031384848434444,-1.0650973427465882,10,512,0.7861356218655904,50000,89.33333333333333,0.5224929168017198,"{""activacion"": ""relu"", ""arquitectura"": ""grande"", ""batch_size"": 512, ""clip_range"": 0.2, ""ent_coef"": 5.917316047607217e-07, ""esquema_lr"": ""lineal"", ""learning_rate"": 0.00031384848434444, ""log_std_init"": -1.0650973427465882, ""n_epochs"": 10, ""n_steps"": 512}",PRUNED
14,-2.5647484381125323,2026-10-02 17:05:34.439059,2026-10-02 17:06:17.622890,0 days 00:00:43.183831,tanh,pequena,512,0.2,0.00025271039815718925,constante,0.00043997231634233943,-1.7732748021605593,20,512,0.6000083486239115,50000,94.33333333333334,0.5504158610697513,"{""activacion"": ""tanh"", ""arquitectura"": ""pequena"", ""batch_size"": 512, ""clip_range"": 0.2, ""ent_coef"": 0.00025271039815718925, ""esquema_lr"": ""constante"", ""learning_rate"": 0.00043997231634233943, ""log_std_init"": -1.7732748021605593, ""n_epochs"": 20, ""n_steps"": 512}",PRUNED
15,-2.450927428045659,2026-10-02 17:06:05.256141,2026-10-02 17:06:46.218802,0 days 00:00:40.962661,relu,pequena,512,0.2,2.179323373542211e-06,constante,6.731863893225698e-05,-2.2552482842870765,20,64,0.5837250073750814,50000,88.0,0.5042213572735109,"{""activacion"": ""relu"", ""arquitectura"": ""pequena"", ""batch_size"": 512, ""clip_range"": 0.2, ""ent_coef"": 2.179323373542211e-06, ""esquema_lr"": ""constante"", ""learning_rate"": 6.731863893225698e-05, ""log_std_init"": -2.2552482842870765, ""n_epochs"": 20, ""n_steps"": 64}",PRUNED
16,1.41867290835256,2026-10-02 17:06:18.017013,2026-10-02 17:13:34.777605,0 days 00:07:16.760592,relu,grande,128,0.2,3.1998590731037486e-05,lineal,0.00046524467199286713,-1.7622392193324128,10,64,7.173936231931051,300000,90.66666666666666,0.11723991000401394,"{""activacion"": ""relu"", ""arquitectura"": ""grande"", ""batch_size"": 128, ""clip_range"": 0.2, ""ent_coef"": 3.1998590731037486e-05, ""esquema_lr"": ""lineal"", ""learning_rate"": 0.00046524467199286713, ""log_std_init"": -1.7622392193324128, ""n_epochs"": 10, ""n_steps"": 64}",COMPLETE
17,1.1913909396143467,2026-10-02 17:06:46.570977,2026-10-02 17:15:15.993375,0 days 00:08:29.422398,relu,grande,256,0.2,4.658380832960443e-06,lineal,0.0008292668559060517,-1.1665512538769969,20,64,8.391893792152405,300000,87.33333333333333,0.1175364274610421,"{""activacion"": ""relu"", ""arquitectura"": ""grande"", ""batch_size"": 256, ""clip_range"": 0.2, ""ent_coef"": 4.658380832960443e-06, ""esquema_lr"": ""lineal"", ""learning_rate"": 0.0008292668559060517, ""log_std_init"": -1.1665512538769969, ""n_epochs"": 20, ""n_steps"": 64}",COMPLETE
18,0.7660311823495929,2026-10-02 17:13:35.206881,2026-10-02 17:16:58.232179,0 days 00:03:23.025298,relu,grande,128,0.2,2.171682581306655e-05,lineal,9.139322345190274e-05,-1.3376386354398622,10,64,3.2752739667892454,150000,87.33333333333333,0.1648372753867663,"{""activacion"": ""relu"", ""arquitectura"": ""grande"", ""batch_size"": 128, ""clip_range"": 0.2, ""ent_coef"": 2.171682581306655e-05, ""esquema_lr"": ""lineal"", ""learning_rate"": 9.139322345190274e-05, ""log_std_init"": -1.3376386354398622, ""n_epochs"": 10, ""n_steps"": 64}",PRUNED
19,1.2676179483398957,2026-10-02 17:15:16.424061,2026-10-02 17:19:59.431254,0 days 00:04:43.007193,relu,grande,512,0.3,3.783807438343822e-07,lineal,0.0009946363639105921,-1.835078656469458,10,64,4.619250388940175,300000,90.66666666666666,0.12931433536392523,"{""activacion"": ""relu"", ""arquitectura"": ""grande"", ""batch_size"": 512, ""clip_range"": 0.3, ""ent_coef"": 3.783807438343822e-07, ""esquema_lr"": ""lineal"", ""learning_rate"": 0.0009946363639105921, ""log_std_init"": -1.835078656469458, ""n_epochs"": 10, ""n_steps"": 64}",COMPLETE
20,-0.7805214500549099,2026-10-02 17:16:58.607037,2026-10-02 17:17:55.844246,0 days 00:00:57.237209,relu,grande,256,0.2,2.4444676697706267e-05,lineal,0.0007567574236958934,-2.763129186089956,10,64,0.8489042957623799,50000,88.0,0.3272885449960234,"{""activacion"": ""relu"", ""arquitectura"": ""grande"", ""batch_size"": 256, ""clip_range"": 0.2, ""ent_coef"": 2.4444676697706267e-05, ""esquema_lr"": ""lineal"", ""learning_rate"": 0.0007567574236958934, ""log_std_init"": -2.763129186089956, ""n_epochs"": 10, ""n_steps"": 64}",PRUNED
21,-3.458629903253468,2026-10-02 17:17:56.194382,2026-10-02 17:18:39.717473,0 days 00:00:43.523091,relu,pequena,128,0.2,2.643607411443813e-08,lineal,0.0005442986639889941,-2.304262839592324,10,512,0.6292603969573974,50000,80.33333333333333,0.5720016323611161,"{""activacion"": ""relu"", ""arquitectura"": ""pequena"", ""batch_size"": 128, ""clip_range"": 0.2, ""ent_coef"": 2.643607411443813e-08, ""esquema_lr"": ""lineal"", ""learning_rate"": 0.0005442986639889941, ""log_std_init"": -2.304262839592324, ""n_epochs"": 10, ""n_steps"": 512}",PRUNED
22,1.3714826793714945,2026-10-02 17:18:40.106898,2026-10-02 17:26:51.131459,0 days 00:08:11.024561,relu,grande,256,0.2,1.5891353479960733e-05,lineal,0.0007355140506280141,-0.8889584444786081,20,128,8.084066025416057,300000,88.66666666666667,0.11195091154206774,"{""activacion"": ""relu"", ""arquitectura"": ""grande"", ""batch_size"": 256, ""clip_range"": 0.2, ""ent_coef"": 1.5891353479960733e-05, ""esquema_lr"": ""lineal"", ""learning_rate"": 0.0007355140506280141, ""log_std_init"": -0.8889584444786081, ""n_epochs"": 20, ""n_steps"": 128}",COMPLETE
23,1.3083436795073007,2026-10-02 17:19:59.851817,2026-10-02 17:25:25.562451,0 days 00:05:25.710634,relu,grande,256,0.2,5.165699511832388e-08,lineal,0.000373313051058353,-1.8577694922958854,10,64,5.3116974631945295,300000,91.66666666666666,0.13037697313957397,"{""activacion"": ""relu"", ""arquitectura"": ""grande"", ""batch_size"": 256, ""clip_range"": 0.2, ""ent_coef"": 5.165699511832388e-08, ""esquema_lr"": ""lineal"", ""learning_rate"": 0.000373313051058353, ""log_std_init"": -1.8577694922958854, ""n_epochs"": 10, ""n_steps"": 64}",COMPLETE
24,-1.1566093477664474,2026-10-02 17:25:26.007446,2026-10-02 17:26:21.536378,0 days 00:00:55.528932,relu,grande,256,0.3,4.1954695306145434e-08,lineal,0.00025179575146339365,-2.5980175509509844,10,64,0.8263902227083842,50000,84.33333333333334,0.33905708547555713,"{""activacion"": ""relu"", ""arquitectura"": ""grande"", ""batch_size"": 256, ""clip_range"": 0.3, ""ent_coef"": 4.1954695306145434e-08, ""esquema_lr"": ""lineal"", ""learning_rate"": 0.00025179575146339365, ""log_std_init"": -2.5980175509509844, ""n_epochs"": 10, ""n_steps"": 64}",PRUNED
25,0.17753087640185303,2026-10-02 17:26:21.873406,2026-10-02 17:27:30.649655,0 days 00:01:08.776249,relu,grande,128,0.2,1.9663212890144245e-07,lineal,0.0001244218771408992,-1.6238288689753597,10,64,1.048104425271352,50000,86.33333333333333,0.2233251402674017,"{""activacion"": ""relu"", ""arquitectura"": ""grande"", ""batch_size"": 128, ""clip_range"": 0.2, ""ent_coef"": 1.9663212890144245e-07, ""esquema_lr"": ""lineal"", ""learning_rate"": 0.0001244218771408992, ""log_std_init"": -1.6238288689753597, ""n_epochs"": 10, ""n_steps"": 64}",PRUNED
26,0.3864054397102863,2026-10-02 17:26:51.548726,2026-10-02 17:27:37.381036,0 days 00:00:45.832310,relu,pequena,256,0.2,0.0002307526330401007,lineal,0.0005840283230638583,-0.6954753541324048,20,128,0.6627985874811808,50000,93.0,0.22433828281804222,"{""activacion"": ""relu"", ""arquitectura"": ""pequena"", ""batch_size"": 256, ""clip_range"": 0.2, ""ent_coef"": 0.0002307526330401007, ""esquema_lr"": ""lineal"", ""learning_rate"": 0.0005840283230638583, ""log_std_init"": -0.6954753541324048, ""n_epochs"": 20, ""n_steps"": 128}",PRUNED
27,0.05517709403824662,2026-10-02 17:27:31.113368,2026-10-02 17:28:34.714931,0 days 00:01:03.601563,relu,media,256,0.2,1.802525772371235e-05,lineal,0.0002835536782348939,-0.6160829068226994,20,128,0.9534695267677307,50000,89.66666666666666,0.24961739257302853,"{""activacion"": ""relu"", ""arquitectura"": ""media"", ""batch_size"": 256, ""clip_range"": 0.2, ""ent_coef"": 1.802525772371235e-05, ""esquema_lr"": ""lineal"", ""learning_rate"": 0.0002835536782348939, ""log_std_init"": -0.6160829068226994, ""n_epochs"": 20, ""n_steps"": 128}",PRUNED
28,1.5172617585165653,2026-10-02 17:27:37.773660,2026-10-02 17:37:37.114733,0 days 00:09:59.341073,relu,grande,64,0.3,0.00029342481318940256,lineal,0.000405157551651527,-1.957936914778382,10,64,9.895848798751832,300000,93.33333333333333,0.11616441974605062,"{""activacion"": ""relu"", ""arquitectura"": ""grande"", ""batch_size"": 64, ""clip_range"": 0.3, ""ent_coef"": 0.00029342481318940256, ""esquema_lr"": ""lineal"", ""learning_rate"": 0.000405157551651527, ""log_std_init"": -1.957936914778382, ""n_epochs"": 10, ""n_steps"": 64}",COMPLETE
29,-3.5527208267941144,2026-10-02 17:28:35.067809,2026-10-02 17:29:42.116680,0 days 00:01:07.048871,relu,grande,512,0.2,3.0019651113143343e-06,lineal,0.0005553154731700246,-0.2557095275036688,20,128,1.0203569213549295,50000,78.66666666666666,0.15300787804477878,"{""activacion"": ""relu"", ""arquitectura"": ""grande"", ""batch_size"": 512, ""clip_range"": 0.2, ""ent_coef"": 3.0019651113143343e-06, ""esquema_lr"": ""lineal"", ""learning_rate"": 0.0005553154731700246, ""log_std_init"": -0.2557095275036688, ""n_epochs"": 20, ""n_steps"": 128}",PRUNED
30,0.1779557993149957,2026-10-02 17:29:42.469035,2026-10-02 17:30:38.871148,0 days 00:00:56.402113,relu,grande,256,0.2,4.60065516012385e-08,lineal,0.0006593210446974869,-1.0485574323979727,10,128,0.8429086446762085,50000,94.66666666666667,0.25275807453260424,"{""activacion"": ""relu"", ""arquitectura"": ""grande"", ""batch_size"": 256, ""clip_range"": 0.2, ""ent_coef"": 4.60065516012385e-08, ""esquema_lr"": ""lineal"", ""learning_rate"": 0.0006593210446974869, ""log_std_init"": -1.0485574323979727, ""n_epochs"": 10, ""n_steps"": 128}",PRUNED
